{
  "messageId": "f73e161c-b72d-5f1f-a892-7fc7db8e83dd",
  "type": "OrcamentoGerado",
  "version": 1,
  "sagaId": "291be3b9-8b0d-583e-94c1-f9d2ae911fb3",
  "osId": 101,
  "causationId": "11bb76b9-241d-58ad-8339-f51ff273f3a9",
  "requestId": "req-feliz-947a90",
  "occurredAt": "2026-10-07T13:00:02Z",
  "payload": {
    "orcamentoId": "93f0be09-1d79-5c92-a371-0cd69b36a8de",
    "valorTotalCentavos": 45990,
    "validoAte": "2026-10-14T13:00:02Z"
  }
}
