{
  "messageId": "c8ea987c-a0cb-579c-ad08-35c027df291d",
  "type": "ExecucaoFinalizada",
  "version": 1,
  "sagaId": "6f1c2a9e-3b7d-4c1e-9a2f-0d5e8b7c4a11",
  "osId": 101,
  "causationId": "c1f80cfe-345f-52cf-80a1-21f38fd7aee1",
  "requestId": "req-feliz-a7c3e9",
  "occurredAt": "2026-10-08T10:45:00Z",
  "payload": {
    "execucaoId": "e7a9c1d3-5f6b-4c8e-a1b3-6c8e0a2c4d55",
    "finalizadaEm": "2026-10-08T10:45:00Z"
  }
}
