{
  "messageId": "b6a25a46-18fb-5548-a981-e84f5a1bcc87",
  "type": "OrcamentoCancelado",
  "version": 1,
  "sagaId": "0b9e7d3c-5a2f-4e8b-8c1d-7f6a5e4d3c22",
  "osId": 102,
  "causationId": "ab45c39d-a99d-50f3-abd3-07c8704e36c2",
  "requestId": "req-comp-b4d8f2",
  "occurredAt": "2026-10-07T16:10:03Z",
  "payload": {
    "orcamentoId": "c5e7a9b1-3d4f-4a6c-9d2f-4a6c8e0a2b44"
  }
}
