{
  "messageId": "11bb76b9-241d-58ad-8339-f51ff273f3a9",
  "type": "GerarOrcamento",
  "version": 1,
  "sagaId": "291be3b9-8b0d-583e-94c1-f9d2ae911fb3",
  "osId": 101,
  "causationId": null,
  "requestId": "req-feliz-947a90",
  "occurredAt": "2026-10-07T13:00:00Z",
  "payload": {
    "clienteId": 7,
    "veiculoId": 15,
    "servicos": [
      {
        "servicoId": 12,
        "quantidade": 1
      }
    ],
    "pecas": [
      {
        "pecaId": 40,
        "quantidade": 2
      }
    ]
  }
}
