{
  "messageId": "fc1c3215-d9e8-5a4d-a83e-0143d3f1774c",
  "type": "OrcamentoAprovado",
  "version": 1,
  "sagaId": "291be3b9-8b0d-583e-94c1-f9d2ae911fb3",
  "osId": 101,
  "causationId": "f73e161c-b72d-5f1f-a892-7fc7db8e83dd",
  "requestId": "req-feliz-947a90",
  "occurredAt": "2026-10-07T15:20:00Z",
  "payload": {
    "orcamentoId": "93f0be09-1d79-5c92-a371-0cd69b36a8de",
    "aprovadoEm": "2026-10-07T15:19:58Z"
  }
}
