{
  "messageId": "c1f80cfe-345f-52cf-80a1-21f38fd7aee1",
  "type": "ExecucaoIniciada",
  "version": 1,
  "sagaId": "6f1c2a9e-3b7d-4c1e-9a2f-0d5e8b7c4a11",
  "osId": 101,
  "causationId": "c58d60bb-c94b-534e-b6e9-165a9da34d74",
  "requestId": "req-feliz-a7c3e9",
  "occurredAt": "2026-10-07T15:20:03Z",
  "payload": {
    "execucaoId": "e7a9c1d3-5f6b-4c8e-a1b3-6c8e0a2c4d55",
    "orcamentoId": "a3d5f7b9-1c2e-4f6a-8b0d-2e4f6a8c0e33",
    "iniciadaEm": "2026-10-07T15:20:03Z"
  }
}
